{
	"version": 1,
	"stage": "dev",
	"region": "ca-central-1",
	"allowedOrigins": [
		"https://d1xn0o010v89mt.cloudfront.net"
	],
	"logRetentionDays": 14,
	"diagnosticEndpoint": "https://d1xn0o010v89mt.cloudfront.net/health",
	"capabilities": {
		"cloudSync": true,
		"remotePlay": true,
		"clientTelemetry": true
	},
	"featureFlags": []
}
