{
	"version": 1,
	"stage": "prod",
	"region": "ca-central-1",
	"allowedOrigins": [
		"https://invalid.example"
	],
	"logRetentionDays": 90,
	"diagnosticEndpoint": "https://invalid.example/health",
	"capabilities": {
		"cloudSync": true,
		"remotePlay": true,
		"clientTelemetry": false
	},
	"featureFlags": []
}
